{
  "framework_version": "0.5.0",
  "cycle": "20260929_4e1a",
  "artifact": ".sdlc/cycles/20260929_4e1a/intent.md",
  "interrogated_at": "2026-09-29T00:53:27Z",
  "round": 1,
  "findings": [
    {
      "id": "F_01",
      "severity": "blocking",
      "disposition": "open",
      "cites": "CON_02",
      "statement": "The intent settles, as part of what done looks like, that a second asking yields a value other than the previous one - a behaviour nobody stated in the interview, and one a fair six-sided die contradicts roughly one time in six, so the spec can derive from it a criterion that consecutive requests differ, a test that asserts it, and a green verification of a die that is not impartial.",
      "locus": "\"Asking again produces another roll, not the one before.\" - ## Done looks like",
      "remedy": "State only what was established: each asking produces its own roll, decided independently of any roll before it. Remove the claim that the value differs, and say explicitly that two consecutive rolls showing the same number is a consequence of impartiality rather than a defect, so no criterion is derived requiring them to differ. If anyone does want repeats suppressed, that is a decision and belongs under Fixed decisions with attribution."
    },
    {
      "id": "F_02",
      "severity": "suggestion",
      "disposition": "open",
      "cites": "CON_02",
      "statement": "\"Nothing on the page suggests a person picked the number\" asserts a requirement about what the page conveys to a reader that nobody stated in the interview, and it settles in weaker form the very question Open 3 records as unsettled.",
      "locus": "\"Nothing on the page suggests a person picked the number\" - ## Done looks like"
    }
  ]
}
