{
  "framework_version": "0.5.0",
  "cycle": "20260929_4e1a",
  "artifact": ".sdlc/cycles/20260929_4e1a/plan.md",
  "interrogated_at": "2026-09-29T01:32:27Z",
  "round": 2,
  "findings": [
    {
      "id": "F_02",
      "severity": "suggestion",
      "disposition": "open",
      "cites": "CON_06",
      "statement": "Carried from round 1 and unchanged: criterion 5's proof rests entirely on the substituted roll source, so it would stay green if the production roller derived its value from the request - seeding from a header or a trace identifier - which is the criterion being unmet, and the Cannot prove entry about the production roller discloses only that it might be constant, not that it might read the request.",
      "locus": "## Proof, \"Criterion 5 - no player-supplied input determines the value\""
    }
  ]
}
